id,title,created_at,reply_count,views,description,creator_link,creator_name,creator_alias,post_date,post_likes,replies,repliers_links,reply_dates,reply_likes
94002,How can I use multiple GPUs on WSL2?,2020-08-25T05:14:56.533Z,1,107,"<div class=""post"" itemprop=""articleBody""><NewLine><p>Hello,</p><NewLine><p>I try to use multiple GPUs (RTX 2080Ti *2) with torch.distributed and pytorch-lightning on WSL2 (windows subsystem for linux).<br/><NewLine>But I receiving following error:</p><NewLine><pre><code class=""lang-auto"">NCCL error in: /pytorch/torch/lib/c10d/ProcessGroupNCCL.cpp:518, unhandled system error, NCCL version 2.4.8<NewLine></code></pre><NewLine><p>I can run same process using single GPU.</p><NewLine><p>Thanks for your great help.</p><NewLine></div>",https://discuss.pytorch.org/u/Naruki_Ichihara,(Naruki Ichihara),Naruki_Ichihara,"August 25, 2020,  5:14am",,"REPLY 1: <div class=""post"" itemprop=""articleBody""><NewLine><p>Is SLI enabled? What the output of nvidia-smi?</p><NewLine></div>; <NewLine> REPLY 2: <div class=""post"" itemprop=""articleBody""><NewLine><p>Thank you for your reply.<br/><NewLine>Since I use CUDA on WSL (<a href=""https://docs.nvidia.com/cuda/wsl-user-guide/index.html#getting-started"" rel=""nofollow noopener"">https://docs.nvidia.com/cuda/wsl-user-guide/index.html#getting-started</a>), Ubuntu (on WSL) cannot use the “nvidia-smi” utility.<br/><NewLine>nvidia-smi on windows shell output following:</p><NewLine><pre><code class=""lang-auto"">+-----------------------------------------------------------------------------+<NewLine>| NVIDIA-SMI 455.41       Driver Version: 455.41       CUDA Version: 11.1     |<NewLine>|-------------------------------+----------------------+----------------------+<NewLine>| GPU  Name            TCC/WDDM | Bus-Id        Disp.A | Volatile Uncorr. ECC |<NewLine>| Fan  Temp  Perf  Pwr:Usage/Cap|         Memory-Usage | GPU-Util  Compute M. |<NewLine>|===============================+======================+======================|<NewLine>|   0  GeForce RTX 208... WDDM  | 00000000:1A:00.0  On |                  N/A |<NewLine>| 41%   50C    P0    59W / 250W |    662MiB / 11264MiB |      0%      Default |<NewLine>+-------------------------------+----------------------+----------------------+<NewLine>|   1  GeForce RTX 208... WDDM  | 00000000:68:00.0 Off |                  N/A |<NewLine>| 27%   35C    P8    20W / 250W |    216MiB / 11264MiB |      0%      Default |<NewLine>+-------------------------------+----------------------+----------------------+<NewLine><NewLine>+-----------------------------------------------------------------------------+<NewLine>| Processes:                                                                  |<NewLine>|  GPU   GI   CI        PID   Type   Process name                  GPU Memory |<NewLine>|        ID   ID                                                   Usage      |<NewLine></code></pre><NewLine><p>Does this output mean SLI is enabled?</p><NewLine></div>; <NewLine> ",REPLIER 1: https://discuss.pytorch.org/u/ebarsoum; <NewLine> REPLIER 2: https://discuss.pytorch.org/u/Naruki_Ichihara; <NewLine> ,"REPLY_DATE 1: August 25, 2020,  6:29am; <NewLine> REPLY_DATE 2: August 25, 2020,  7:49am; <NewLine> ",REPLY 1 LIKES: ; <NewLine> REPLY 2 LIKES: ; <NewLine> 
93697,ModuleNotFoundError: No module named &lsquo;torch&rsquo; in IDLE,2020-08-22T03:49:56.945Z,0,52,"<div class=""post"" itemprop=""articleBody""><NewLine><p>So I installed pytorch through anaconda successfully and when I try importing torch in IDLE I get this error</p><NewLine><p>I did what I found on stack exchange “print(sys.executable)”</p><NewLine><p>Conda’s result: C:\Users\readz\anaconda3\python.exe<br/><NewLine>IDLE’s result: C:\Users\readz\AppData\Local\Programs\Python\Python38-32\pythonw.exe</p><NewLine><p>Problem is there they didn’t explain what to do with this info or how to solve the problem…</p><NewLine></div>",https://discuss.pytorch.org/u/Jay,,Jay,"August 22, 2020,  3:49am",,"REPLY 1: <div class=""post"" itemprop=""articleBody""><NewLine><p>Did you install <code>IDLE</code> in the same conda environment and executed it there?<br/><NewLine>If not, could you do it, as currently <code>IDLE</code> seems to use another Python environment.</p><NewLine></div>; <NewLine> ",REPLIER 1: https://discuss.pytorch.org/u/ptrblck; <NewLine> ,"REPLY_DATE 1: August 24, 2020,  9:33am; <NewLine> ",REPLY 1 LIKES: ; <NewLine> 
93639,Detectron 2 on Windows 10,2020-08-21T14:27:06.025Z,0,63,"<div class=""post"" itemprop=""articleBody""><NewLine><p>Is their any way to install  detectron 2 on windows ?</p><NewLine></div>",https://discuss.pytorch.org/u/Heisenberg_082001,(Pranav Kushare),Heisenberg_082001,"August 21, 2020,  2:27pm",,"REPLY 1: <div class=""post"" itemprop=""articleBody""><NewLine><p>Based on this information from the <a href=""https://github.com/facebookresearch/detectron2/blob/master/INSTALL.md"">repository</a>:</p><NewLine><blockquote><NewLine><p>Although detectron2 can be installed on windows with some effort (similar to <a href=""https://github.com/facebookresearch/pytorch3d/blob/master/INSTALL.md#2-install-from-a-local-clone"">these</a>), we do not provide official support for it.<br/><NewLine>PRs that improves code compatibility on windows are welcome.</p><NewLine></blockquote><NewLine><p>it doesn’t seem that Windows is supported out of the box.</p><NewLine></div>; <NewLine> ",REPLIER 1: https://discuss.pytorch.org/u/ptrblck; <NewLine> ,"REPLY_DATE 1: August 24, 2020,  9:13am; <NewLine> ",REPLY 1 LIKES: ; <NewLine> 
93779,Can LSTM run multivariate time series?,2020-08-23T08:53:29.101Z,1,97,"<div class=""post"" itemprop=""articleBody""><NewLine><p>Hello, everyone.<br/><NewLine>I want to run Deep Learning model for multivariate time series.</p><NewLine><p>For example, below is the daily delivery amount of post office</p><NewLine><p>delivery date, post office id, delivery amount, weekday, …</p><NewLine><p>which is daily data, multivariate</p><NewLine><p>I want to predict future delivery amount using data above.</p><NewLine><p>Can I run this as deep learning model using LSTM??</p><NewLine><p>That is, can LSTM run mutlivariate time series data for prediction??</p><NewLine><p>If it is not possible, which deep learning model should I use??</p><NewLine><p>Thank you in advance and have a nice day!</p><NewLine></div>",https://discuss.pytorch.org/u/morphism,,morphism,"August 23, 2020,  9:09am",,"REPLY 1: <div class=""post"" itemprop=""articleBody""><NewLine><aside class=""quote no-group"" data-post=""1"" data-topic=""93779"" data-username=""morphism""><NewLine><div class=""title""><NewLine><div class=""quote-controls""></div><NewLine><img alt="""" class=""avatar"" height=""20"" src=""https://discuss.pytorch.org/letter_avatar_proxy/v4/letter/m/f9ae1b/40.png"" width=""20""/> morphism:</div><NewLine><blockquote><NewLine><p>Can I run this as deep learning model using LSTM??</p><NewLine></blockquote><NewLine></aside><NewLine><p>Yes you can use LSTM for time series data prediction. You can find alot of resources for that purpose.</p><NewLine><p>You can check this github repo for research papers and link for data resources.<br/><NewLine><a href=""https://github.com/Alro10/deep-learning-time-series"" rel=""nofollow noopener"">https://github.com/Alro10/deep-learning-time-series</a></p><NewLine><p>If you want to checkout for implementation you can also find that in below link.<br/><NewLine><a href=""https://github.com/zhangxu0307/time_series_forecasting_pytorch"" rel=""nofollow noopener"">https://github.com/zhangxu0307/time_series_forecasting_pytorch</a><br/><NewLine><a href=""https://github.com/KurochkinAlexey/ConvRNN"" rel=""nofollow noopener"">https://github.com/KurochkinAlexey/ConvRNN</a><br/><NewLine><a href=""https://stackoverflow.com/questions/56858924/multivariate-input-lstm-in-pytorch"" rel=""nofollow noopener"">https://stackoverflow.com/questions/56858924/multivariate-input-lstm-in-pytorch</a></p><NewLine></div>; <NewLine> REPLY 2: <div class=""post"" itemprop=""articleBody""><NewLine><p>Dear Usama:</p><NewLine><p>Thank you for your help and kindness.<br/><NewLine>I believe your advise can solve my problems.<br/><NewLine>I will read them in detail.</p><NewLine><p>Have a nice day and see you, Usama.</p><NewLine></div>; <NewLine> ",REPLIER 1: https://discuss.pytorch.org/u/Usama_Hasan; <NewLine> REPLIER 2: https://discuss.pytorch.org/u/morphism; <NewLine> ,"REPLY_DATE 1: August 23, 2020,  9:50am; <NewLine> REPLY_DATE 2: August 23, 2020, 12:03pm; <NewLine> ",REPLY 1 LIKES: ; <NewLine> REPLY 2 LIKES: ; <NewLine> 
93012,Initial Pytorch setup and another few questions,2020-08-16T17:17:57.558Z,0,81,"<div class=""post"" itemprop=""articleBody""><NewLine><p>Hi everyone .</p><NewLine><p>I’m new to Pytorch and I’m trying to figure out a few things right now .</p><NewLine><p>I have the following components :</p><NewLine><pre><code class=""lang-auto"">   ...:<NewLine>`__Python VERSION: 3.6.5 |Anaconda, Inc.| (default, Mar 29 2018, 13:32:41) [MSC v.1900 64 bit (AMD64)]<NewLine>__pyTorch VERSION: 1.2.0+cu92<NewLine>__CUDA VERSION<NewLine>nvcc: NVIDIA (R) Cuda compiler driver<NewLine>Copyright (c) 2005-2018 NVIDIA Corporation<NewLine>Built on Tue_Jun_12_23:08:12_Central_Daylight_Time_2018<NewLine>Cuda compilation tools, release 9.2, V9.2.148<NewLine>__CUDNN VERSION: 7201<NewLine>__Number CUDA Devices: 1<NewLine>__Devices<NewLine>Active CUDA Device: GPU 0<NewLine>Available devices  1<NewLine>Current cuda device  0``<NewLine></code></pre><NewLine><p>I’m using the following hardware and software :<br/><NewLine><strong>Z440 G4</strong><br/><NewLine><strong>16GB RAM</strong><br/><NewLine><strong>NVIDIA QUADRO RTX 4000 (CUDA supported)</strong><br/><NewLine><strong>Windows server 2012r2</strong><br/><NewLine><strong>Anaconda 3.5.2 - Python 3.6.5 ( I need that specific version) .</strong></p><NewLine><ol><NewLine><li>After the installation of all the components I needed I searched for a training example just to make sure Pytorch is working . I executed the following :</li><NewLine></ol><NewLine><pre><code class=""lang-auto"">`import torch<NewLine> import torch.optim as optim<NewLine><NewLine> model = torch.nn.Linear(5, 2)<NewLine><NewLine>  Initialize optimizer<NewLine> optimizer = optim.SGD(model.parameters(), lr=0.001, momentum=0.9)<NewLine><NewLine> print(""Model's state_dict:"")<NewLine> for param_tensor in model.state_dict():<NewLine>     print(param_tensor, ""\t"", model.state_dict()[param_tensor].size())<NewLine><NewLine> print(""Model weight:"")<NewLine> print(model.weight)<NewLine><NewLine> print(""Model bias:"")<NewLine> print(model.bias)<NewLine><NewLine> print(""---"")<NewLine> print(""Optimizer's state_dict:"")<NewLine> for var_name in optimizer.state_dict():<NewLine>     print(var_name, ""\t"", optimizer.state_dict()[var_name])``<NewLine></code></pre><NewLine><p>And got the following output</p><NewLine><pre><code class=""lang-auto"">Model's state_dict:<NewLine>weight   torch.Size([2, 5])<NewLine>bias     torch.Size([2])<NewLine>Model weight:<NewLine>Parameter containing:<NewLine>tensor([[-0.1759, -0.2537,  0.1401,  0.2342, -0.3865],<NewLine>        [-0.2142,  0.2763, -0.2919,  0.2003, -0.3242]], requires_grad=True)<NewLine>Model bias:<NewLine>Parameter containing:<NewLine>tensor([-0.0585,  0.2511], requires_grad=True)<NewLine>---<NewLine>Optimizer's state_dict:<NewLine>state    {}<NewLine>param_groups     [{'lr': 0.001, 'momentum': 0.9, 'dampening': 0, 'weight_decay': 0, 'nesterov': False, 'params': [935863832152, 9358638<NewLine>31360]}]<NewLine></code></pre><NewLine><p>Next I have saved it by using :</p><NewLine><pre><code class=""lang-auto"">torch.save(model.state_dict(), ""temp.pt"")<NewLine></code></pre><NewLine><p>So far it seems OK to me . Anything else I can / Should check in addition ?</p><NewLine><p>2 . How can I check in real time that my GPU is working ? I want to make sure PYTORCH is using the GPU and not the CPU . Anything I can check ? Saved log file maybe ?</p><NewLine><p>Appreciate your help .<br/><NewLine>Please let me know if any information is needed .</p><NewLine></div>",https://discuss.pytorch.org/u/NoamAS,(Noam As),NoamAS,"August 16, 2020,  5:23pm",,"REPLY 1: <div class=""post"" itemprop=""articleBody""><NewLine><aside class=""quote no-group"" data-post=""1"" data-topic=""93012"" data-username=""NoamAS""><NewLine><div class=""title""><NewLine><div class=""quote-controls""></div><NewLine><img alt="""" class=""avatar"" height=""20"" src=""https://discuss.pytorch.org/letter_avatar_proxy/v4/letter/n/d6d6ee/40.png"" width=""20""/> NoamAS:</div><NewLine><blockquote><NewLine><p>How can I check in real time that my GPU is working ?</p><NewLine></blockquote><NewLine></aside><NewLine><p>Push your model to the device and execute a training step:</p><NewLine><pre><code class=""lang-python"">device = 'cuda'<NewLine>model.to(device)<NewLine>data = torch.randn(1, 5, device=device)<NewLine>out = model(data)<NewLine>out.mean().backward()<NewLine></code></pre><NewLine><p>If this code runs fine then your GPU is used.</p><NewLine><p>For more testing, you could execute some <a href=""https://github.com/pytorch/examples"">examples</a>.</p><NewLine></div>; <NewLine> REPLY 2: <div class=""post"" itemprop=""articleBody""><NewLine><p>Thank you for the answer .<br/><NewLine>I don’t have any ready model really so I picked up the following code instead and uncomment the GPU part to make sure the GPU will be used:</p><NewLine><pre><code class=""lang-auto"">: dtype = torch.float<NewLine>: #device = torch.device(""cpu"")<NewLine>: device = torch.device(""cuda:0"") # Uncomment this to run on GPU<NewLine>:<NewLine>: # N is batch size; D_in is input dimension;<NewLine>: # H is hidden dimension; D_out is output dimension.<NewLine>: N, D_in, H, D_out = 64, 1000, 100, 10<NewLine>:<NewLine>: # Create random input and output data<NewLine>: x = torch.randn(N, D_in, device=device, dtype=dtype)<NewLine>: y = torch.randn(N, D_out, device=device, dtype=dtype)<NewLine>:<NewLine>: # Randomly initialize weights<NewLine>: w1 = torch.randn(D_in, H, device=device, dtype=dtype)<NewLine>: w2 = torch.randn(H, D_out, device=device, dtype=dtype)<NewLine>:<NewLine>: learning_rate = 1e-6<NewLine>: for t in range(500):<NewLine>:     # Forward pass: compute predicted y<NewLine>:     h = x.mm(w1)<NewLine>:     h_relu = h.clamp(min=0)<NewLine>:     y_pred = h_relu.mm(w2)<NewLine>:<NewLine>:     # Compute and print loss<NewLine>:     loss = (y_pred - y).pow(2).sum().item()<NewLine>:     if t % 100 == 99:<NewLine>:         print(t, loss)<NewLine>:<NewLine>:     # Backprop to compute gradients of w1 and w2 with respect to loss<NewLine>:     grad_y_pred = 2.0 * (y_pred - y)<NewLine>:     grad_w2 = h_relu.t().mm(grad_y_pred)<NewLine>:     grad_h_relu = grad_y_pred.mm(w2.t())<NewLine>:     grad_h = grad_h_relu.clone()<NewLine>:     grad_h[h &lt; 0] = 0<NewLine>:     grad_w1 = x.t().mm(grad_h)<NewLine>:<NewLine>:     # Update weights using gradient descent<NewLine>:     w1 -= learning_rate * grad_w1<NewLine>:     w2 -= learning_rate * grad_w2<NewLine></code></pre><NewLine><p>Got the following:</p><NewLine><pre><code class=""lang-auto"">99 384.6168518066406<NewLine>199 2.1987862586975098<NewLine>299 0.02469571679830551<NewLine>399 0.0005685320356860757<NewLine>499 7.920750067569315e-05<NewLine></code></pre><NewLine></div>; <NewLine> ",REPLIER 1: https://discuss.pytorch.org/u/ptrblck; <NewLine> REPLIER 2: https://discuss.pytorch.org/u/NoamAS; <NewLine> ,"REPLY_DATE 1: August 18, 2020,  8:06am; <NewLine> REPLY_DATE 2: August 18, 2020,  8:50am; <NewLine> ",REPLY 1 LIKES: ; <NewLine> REPLY 2 LIKES: ; <NewLine> 
