id,title,created_at,reply_count,views,description,creator_link,creator_name,creator_alias,post_date,post_likes,replies,repliers_links,reply_dates,reply_likes
89244,About the windows category,2020-07-15T03:07:16.244Z,0,54,"<div class=""post"" itemprop=""articleBody""><NewLine><p>This category is focused on PyTorch on Windows related issues.</p><NewLine></div>",https://discuss.pytorch.org/u/jspisak,"(Facebook AI, Product Manager)",jspisak,"July 15, 2020,  3:08am",3 Likes,,,,
91351,Problems after installing pytorch on windows,2020-08-02T03:36:25.716Z,1,936,"<div class=""post"" itemprop=""articleBody""><NewLine><p>I have installed pytorch in a conda environment using</p><NewLine><pre><code class=""lang-auto"">conda install pytorch torchvision cudatoolkit=10.1 -c pytorch<NewLine></code></pre><NewLine><p>However after that I try doing <code>import torch</code><br/><NewLine>and I get the following error</p><NewLine><pre><code class=""lang-auto"">Microsoft Visual C++ Redistributable is not installed, this may lead to the DLL load failure.  <NewLine>It can be downloaded at https://aka.ms/vs/16/release/vc_redist.x64.exe                                 <NewLine>Traceback (most recent call last):                                                                                       <NewLine> File ""&lt;stdin&gt;"", line 1, in &lt;module&gt;                                                                                     <NewLine>File ""C:\Users\aliag\anaconda3\envs\pytorchPractice\lib\site-packages\torch\__init__.py"", line 127, in &lt;module&gt;           <NewLine>raise err                                                                                                           <NewLine>OSError: [WinError 126] 指定されたモジュールが見つかりません。 <NewLine>Error loading ""C:\Users\aliag\anaconda3\envs\pytorchPractice\lib\site-packages\torch\lib\asmjit.dll"" <NewLine>or one of its dependencies.                                                 <NewLine>&gt;&gt;&gt; <NewLine></code></pre><NewLine><p>I would really appreciate some help to correct this problem</p><NewLine></div>",https://discuss.pytorch.org/u/KansaiUser,(David Aliaga),KansaiUser,"August 2, 2020,  3:36am",,"REPLY 1: <div class=""post"" itemprop=""articleBody""><NewLine><p>I found the solution. I had not adequately installed CUDA. When I did it again, the problem dissapears</p><NewLine></div>; <NewLine> REPLY 2: <div class=""post"" itemprop=""articleBody""><NewLine><p><a class=""mention"" href=""/u/kansaiuser"">@KansaiUser</a>, I’m having the same problem. Can you discuss in detail how you solved it?</p><NewLine></div>; <NewLine> REPLY 3: <div class=""post"" itemprop=""articleBody""><NewLine><p><em>Bumping this up</em></p><NewLine><p>Does anyone have a clear solution to this issue? I faced this when I updated from 1.5.0 to 1.6.0 and soon after that doing a fresh install in a new environment. I already have a couple of versions of Visual C++ Redistributable installed (2013 and 2017).</p><NewLine></div>; <NewLine> REPLY 4: <div class=""post"" itemprop=""articleBody""><NewLine><p>Answering my own question: the situation was set right when I installed the Redistributable that’s linked in the error message. However, I don’t understand why the existing ones didn’t work. Also, if this is an requirement that’s not available as part of a conda repository, why is this not mentioned as part of the installation steps?</p><NewLine></div>; <NewLine> ",REPLIER 1: https://discuss.pytorch.org/u/KansaiUser; <NewLine> REPLIER 2: https://discuss.pytorch.org/u/Prithvi_Shankar; <NewLine> REPLIER 3: https://discuss.pytorch.org/u/navneethc; <NewLine> REPLIER 4: https://discuss.pytorch.org/u/navneethc; <NewLine> ,"REPLY_DATE 1: August 3, 2020,  1:27am; <NewLine> REPLY_DATE 2: August 21, 2020, 11:37pm; <NewLine> REPLY_DATE 3: September 26, 2020,  3:30pm; <NewLine> REPLY_DATE 4: September 26, 2020,  5:43pm; <NewLine> ",REPLY 1 LIKES: ; <NewLine> REPLY 2 LIKES: ; <NewLine> REPLY 3 LIKES: ; <NewLine> REPLY 4 LIKES: ; <NewLine> 
95120,WSL cuda not detected,2020-09-04T02:29:58.281Z,0,55,"<div class=""post"" itemprop=""articleBody""><NewLine><p>wsl 4.19.121<br/><NewLine>ubuntu 18.04<br/><NewLine>cuda-toolkit 11.0<br/><NewLine>nvidia driver: 460.15<br/><NewLine>Pytorch: 1.6.0<br/><NewLine>Python: 3.6.8</p><NewLine><p>I’ve followed the steps in this tutorial<br/><NewLine><a class=""onebox"" href=""https://docs.nvidia.com/cuda/wsl-user-guide/index.html"" rel=""nofollow noopener"" target=""_blank"">https://docs.nvidia.com/cuda/wsl-user-guide/index.html</a></p><NewLine><p>But when I run pytorch  <code>torch.cuda.is_available()</code> , it returns False.</p><NewLine></div>",https://discuss.pytorch.org/u/acmilannesta,,acmilannesta,"September 4, 2020,  2:29am",,,,,
94976,Install problem: pytorch 1.2.0 with Cuda 10.2,2020-09-02T22:15:18.067Z,1,43,"<div class=""post"" itemprop=""articleBody""><NewLine><p>Hi,</p><NewLine><p>I’m trying to run code from the following github repository: <a href=""https://github.com/AnticipatedLearningMachine/Anticipated-Learning-Machine"" rel=""nofollow noopener"">https://github.com/AnticipatedLearningMachine/Anticipated-Learning-Machine</a></p><NewLine><p>In the requirements section at the bottom, it says that pytorch 1.2.0 and CUDA 10.2 are required. I have tried installing pytorch 1.2.0 (on Windows Anaconda) via pip, but I get a version that comes with Cuda 9.2. Can someone please help me install pytorch 1.2.0 with CUDA 10.2?</p><NewLine><p>Thanks,<br/><NewLine>Gavin.</p><NewLine></div>",https://discuss.pytorch.org/u/xen,,xen,"September 2, 2020, 10:18pm",,"REPLY 1: <div class=""post"" itemprop=""articleBody""><NewLine><p>I don’t think that the PyTorch <code>1.2.0</code> binaries and wheels were built with CUDA10.2, but with CUDA9.2 and CUDA10.0 as seen <a href=""https://pytorch.org/get-started/previous-versions/#v120"">here</a>.<br/><NewLine>If you need this config for a particular reason, you would most likely have to build PyTorch from source.</p><NewLine></div>; <NewLine> REPLY 2: <div class=""post"" itemprop=""articleBody""><NewLine><p>Great, thank you.</p><NewLine><p>Gavin.</p><NewLine></div>; <NewLine> ",REPLIER 1: https://discuss.pytorch.org/u/ptrblck; <NewLine> REPLIER 2: https://discuss.pytorch.org/u/xen; <NewLine> ,"REPLY_DATE 1: September 2, 2020, 11:02pm; <NewLine> REPLY_DATE 2: September 2, 2020, 11:04pm; <NewLine> ",REPLY 1 LIKES: ; <NewLine> REPLY 2 LIKES: ; <NewLine> 
